{
  "$schema": "https://eventuras.dev/schema/app-config.schema.json",
  "name": "@eventuras/web",
  "type": "app",
  "description": "Main web frontend for Eventuras - participant and organizer interface",
  "env": {
    "APPLICATION_URL": {
      "required": true,
      "client": false,
      "type": "url",
      "description": "Public URL where this application is hosted (e.g., http://localhost:3000). Server-side only."
    },
    "LOGOUT_URL_REDIRECT": {
      "required": true,
      "client": false,
      "type": "url",
      "description": "URL to redirect to after logout. Server-side only."
    },
    "DEFAULT_LOCALE": {
      "required": true,
      "client": false,
      "type": "string",
      "description": "Default locale for internationalization (e.g., en-US, nb-NO)",
      "enum": ["en-US", "nb-NO"]
    },
    "OIDC_ISSUER": {
      "required": true,
      "client": false,
      "type": "url",
      "description": "OIDC provider issuer URL (e.g., https://auth.example.com/application/o/app/). Server-side only – used by server-side PKCE flow."
    },
    "ORGANIZATION_ID": {
      "required": true,
      "client": false,
      "type": "int",
      "description": "The unique organization ID used to scope API calls. Server-side only – passed as prop to client components."
    },
    "SITE_SETTINGS_URL": {
      "required": false,
      "client": false,
      "type": "url",
      "description": "Base URL for fetching public site settings and branding configuration. Server-side only."
    },
    "BACKEND_URL": {
      "required": true,
      "client": false,
      "type": "url",
      "description": "Backend API base URL. Server-side only – passed as prop to client components that need it."
    },
    "OIDC_CLIENT_ID": {
      "required": true,
      "client": false,
      "type": "string",
      "description": "OIDC client identifier used by the backend authentication flow (server-side only)"
    },
    "OIDC_CLIENT_SECRET": {
      "required": true,
      "client": false,
      "type": "string",
      "description": "OIDC client secret for server-side authentication (never expose to client)"
    },
    "OIDC_API_AUDIENCE": {
      "required": false,
      "client": false,
      "type": "string",
      "description": "OIDC API audience identifier for token validation"
    },
    "OIDC_ROLES_CLAIM": {
      "required": false,
      "client": false,
      "type": "string",
      "description": "Name of the claim in the ID token that contains user roles (default: roles)"
    },
    "NODE_ENV": {
      "required": true,
      "client": false,
      "type": "string",
      "description": "Node environment (development, production, test)",
      "enum": ["development", "production", "test"]
    },
    "SESSION_SECRET": {
      "required": true,
      "client": false,
      "type": "string",
      "description": "Secret key for session encryption (must be a strong random string)"
    },
    "SENTRY_DSN": {
      "required": false,
      "client": false,
      "type": "url",
      "description": "GlitchTip/Sentry DSN. Server-side only — emitted to the browser via an inline <script> in the root layout so the SDK can init without a NEXT_PUBLIC_* build arg."
    },
    "SENTRY_ENABLED": {
      "required": false,
      "client": false,
      "type": "bool",
      "description": "Feature flag for Sentry/GlitchTip reporting. When false (or DSN missing), the SDK is not initialized on client or server."
    },
    "SENTRY_SEND_DEFAULT_PII": {
      "required": false,
      "client": false,
      "type": "bool",
      "description": "Whether the SDK may include default PII (IP, headers) on captured events. Defaults to false on the client and true on the server."
    }
  },
  "build": {
    "outDir": ".next",
    "target": "es2022"
  },
  "runtime": {
    "port": 3000
  }
}
